{
  "$schema": "https://json-schema.org/draft/2020-12/schema",
  "$id": "https://github.com/ucsc-redwood/better-together/schemas/device-spec.schema.json",
  "title": "BetterTogether Device Specification",
  "description": "Declarative description of a target SoC's CPU core topology and pinning affinity. One file per device under devices/ replaces a hardcoded entry in builtin-apps/conf.cpp. Adding a new SoC should mean dropping a file here, not editing and recompiling C++.",
  "type": "object",
  "additionalProperties": false,
  "required": ["id", "cores"],
  "properties": {
    "id": {
      "type": "string",
      "minLength": 1,
      "description": "Device identifier used to look the device up at runtime (e.g. an adb serial like '3A021JEHN02756', or a logical name like 'jetson'). Must match the file stem."
    },
    "description": {
      "type": "string",
      "description": "Human-readable model/notes. Informational only; not used at runtime."
    },
    "cores": {
      "type": "array",
      "minItems": 1,
      "description": "CPU cores in this device.",
      "items": { "$ref": "#/$defs/core" }
    },
    "gpu": { "$ref": "#/$defs/gpu" }
  },
  "$defs": {
    "gpu": {
      "type": "object",
      "additionalProperties": false,
      "required": ["backend"],
      "description": "GPU/accelerator descriptor. 'backend' = the GPU compute API the device's accelerator speaks. 'subgroup_size' is informational: the Vulkan engine queries the subgroup size at runtime and only warns if this value disagrees.",
      "properties": {
        "backend": {
          "enum": ["cuda", "vulkan"],
          "description": "GPU compute API for this device (NVIDIA -> cuda, everything else -> vulkan)."
        },
        "name": {
          "type": "string",
          "description": "GPU model. Informational only."
        },
        "subgroup_size": {
          "type": "integer",
          "minimum": 1,
          "description": "Informational: the GPU's default subgroup size as the device reports it (e.g. 16 Mali, 32 NVIDIA, 64 AMD/Xclipse). Not used to select shaders; a mismatch with the runtime-queried size logs a warning."
        }
      }
    },
    "core": {
      "type": "object",
      "additionalProperties": false,
      "required": ["id", "type", "pinnable"],
      "properties": {
        "id": {
          "type": "integer",
          "minimum": 0,
          "description": "OS core id passed to sched_setaffinity."
        },
        "type": {
          "enum": ["little", "medium", "big", "super"],
          "description": "Performance tier; mirrors ProcessorType / CoreTypeName in builtin-apps/conf.hpp."
        },
        "pinnable": {
          "type": "boolean",
          "description": "Whether the scheduler may pin a worker thread to this core."
        }
      }
    }
  }
}
