{
  "id": "9b034f1b",
  "description": "OnePlus 11 (CPH2451, Snapdragon 8 Gen 2): 3 little + 2 medium + 3 big; big cores are not pinnable.",
  "cores": [
    { "id": 0, "type": "little", "pinnable": true },
    { "id": 1, "type": "little", "pinnable": true },
    { "id": 2, "type": "little", "pinnable": true },
    { "id": 3, "type": "medium", "pinnable": true },
    { "id": 4, "type": "medium", "pinnable": true },
    { "id": 5, "type": "big", "pinnable": false },
    { "id": 6, "type": "big", "pinnable": false },
    { "id": 7, "type": "big", "pinnable": false }
  ],
  "gpu": { "backend": "vulkan", "name": "Adreno 740", "subgroup_size": 64 }
}
