{
  "id": "ZY22FLDDK7",
  "description": "Motorola moto g pure, MediaTek MT6762G (32-bit armeabi-v7a userspace): 8x Cortex-A53 in two freq bins -- cores 0-3 @2.0GHz (cap 1024) -> big, cores 4-7 @1.5GHz (cap 768) -> little. GPU PowerVR Rogue GE8320: cifar kernels (no subgroup) verified numerically correct, but the subgroup-arithmetic radix sort (tree stage 2) gives all-zero output for every subgroup_size (16/32/64) -- a PowerVR subgroup limitation, so tree is unsupported here. subgroup_size kept at 32 (irrelevant to the working cifar path).",
  "cores": [
    { "id": 0, "type": "big", "pinnable": true },
    { "id": 1, "type": "big", "pinnable": true },
    { "id": 2, "type": "big", "pinnable": true },
    { "id": 3, "type": "big", "pinnable": true },
    { "id": 4, "type": "little", "pinnable": true },
    { "id": 5, "type": "little", "pinnable": true },
    { "id": 6, "type": "little", "pinnable": true },
    { "id": 7, "type": "little", "pinnable": true }
  ],
  "gpu": {
    "backend": "vulkan",
    "name": "PowerVR Rogue GE8320",
    "subgroup_size": 32
  }
}
