{
  "id": "pc",
  "description": "Generic x86_64 desktop: 8 big cores + 16 little cores.",
  "cores": [
    { "id": 0, "type": "big", "pinnable": true },
    { "id": 1, "type": "big", "pinnable": true },
    { "id": 2, "type": "big", "pinnable": true },
    { "id": 3, "type": "big", "pinnable": true },
    { "id": 4, "type": "big", "pinnable": true },
    { "id": 5, "type": "big", "pinnable": true },
    { "id": 6, "type": "big", "pinnable": true },
    { "id": 7, "type": "big", "pinnable": true },
    { "id": 8, "type": "little", "pinnable": true },
    { "id": 9, "type": "little", "pinnable": true },
    { "id": 10, "type": "little", "pinnable": true },
    { "id": 11, "type": "little", "pinnable": true },
    { "id": 12, "type": "little", "pinnable": true },
    { "id": 13, "type": "little", "pinnable": true },
    { "id": 14, "type": "little", "pinnable": true },
    { "id": 15, "type": "little", "pinnable": true },
    { "id": 16, "type": "little", "pinnable": true },
    { "id": 17, "type": "little", "pinnable": true },
    { "id": 18, "type": "little", "pinnable": true },
    { "id": 19, "type": "little", "pinnable": true },
    { "id": 20, "type": "little", "pinnable": true },
    { "id": 21, "type": "little", "pinnable": true },
    { "id": 22, "type": "little", "pinnable": true },
    { "id": 23, "type": "little", "pinnable": true }
  ],
  "gpu": { "backend": "vulkan", "name": "Intel UHD Graphics 770", "subgroup_size": 32 }
}
