{
  "id": "jetsonlowpower",
  "description": "NVIDIA Jetson Orin Nano (7W low-power mode): 4 cores, single tier.",
  "cores": [
    { "id": 0, "type": "little", "pinnable": true },
    { "id": 1, "type": "little", "pinnable": true },
    { "id": 2, "type": "little", "pinnable": true },
    { "id": 3, "type": "little", "pinnable": true }
  ],
  "gpu": {
    "backend": "cuda",
    "name": "NVIDIA Tegra Orin (nvgpu)",
    "subgroup_size": 32
  }
}
